{"artifact_sources":{"baseline_solidity":"replay/contracts/VaultV1.sol","candidate_solidity":"replay/contracts/VaultV2Declared.sol","corpus":"replay/corpus/transactions.json","transaction_corpus_hash":"3c2551a9c3db638fad77893093ed15ece6569d468f201387bec7ecf64ae66a40"},"baseline":{"bytecode_hash":"0xfc645a42da5baa0472fd2ba8e215f8269ed3f3105c5ef95c086e9311c69e2ded","deployment":{"block_hash":"0xf5178b095fcc16b2c6002a614237ab9fcb047d843e33c6d2f65332f5d6ff21c5","block_number":1,"bytecode_hash":"0xfc645a42da5baa0472fd2ba8e215f8269ed3f3105c5ef95c086e9311c69e2ded","gas_used":"271249","status":"SUCCESS","transaction_hash":"0xf8ada8a8ec0186f107f1109185ba8ff29cb9867c3a2d29b3a99015477f86da41"},"implementation":"VaultV1","source_hash":"14dd4b407c84ceffdb8a49615c0804615f1176e49b2c7fcad452393a13de5a20","storage_layout_hash":"7bd6c2cdb1d727f20cdd6f758ff65ec8fa1a46a005dd0dbe2166368fbd2ed797"},"build":{"chain_id":31337,"compiler_version":"0.8.30+commit.73712a01.Emscripten.clang","executor":"Hardhat local EVM","hardhat_version":"2.29.1","optimizer":{"enabled":true,"runs":200}},"candidate":{"bytecode_hash":"0x8344a49a37174b38eb44f7a1f6ea1e4bb97d57f7d46ca4363920524a47194acf","deployment":{"block_hash":"0x7835ca14da5b5b806a07fa1eb6d2c73b97056158f3a499b71400e764437d7510","block_number":1,"bytecode_hash":"0x8344a49a37174b38eb44f7a1f6ea1e4bb97d57f7d46ca4363920524a47194acf","gas_used":"356535","status":"SUCCESS","transaction_hash":"0x3f22e6110a6abd51471d38da31c0339fb967f07ffb8e3194e8173a708ab5a200"},"implementation":"VaultV2Declared","source_hash":"ef44de6a441a13c9b9b905f312795a194c64a260ed7fb2451d61c1052e4dd5dc","storage_layout_hash":"45a891164d268448a605f32e38a191b0022b39f1123d1e4b33c5586e6e13adc2"},"capability_diffs":[{"added":true,"baseline_observed":false,"declaration_id":"DECL-PERMISSIONS","id":"CAP-OWNER-PAUSE","observed":true}],"corpus":{"dataset_hash":"3c2551a9c3db638fad77893093ed15ece6569d468f201387bec7ecf64ae66a40","dataset_id":"ratchet-vault-review-corpus-v1","transaction_count":7},"coverage":{"executed_case_ids":["ADMIN-WITHDRAW-ALICE-5","DEPOSIT-ALICE-100","DEPOSIT-BOB-40","PAUSE-OFF","PAUSE-ON","WITHDRAW-ALICE-10-AFTER-PAUSE","WITHDRAW-ALICE-20"],"missing_case_ids":[],"required_case_ids":["ADMIN-WITHDRAW-ALICE-5","DEPOSIT-ALICE-100","DEPOSIT-BOB-40","PAUSE-OFF","PAUSE-ON","WITHDRAW-ALICE-10-AFTER-PAUSE","WITHDRAW-ALICE-20"]},"external_call_diffs":[{"baseline":[{"amount":"20","case_id":"WITHDRAW-ALICE-20","operation":"withdraw_recipient_native_transfer","outcome":"COMPLETED","receipt_event":"Withdrawn","recipient":"0x70997970C51812dc3A010C7d01b50e0d17dc79C8","witness":"post-transfer event in the actual EVM transaction receipt"},{"amount":"10","case_id":"WITHDRAW-ALICE-10-AFTER-PAUSE","operation":"withdraw_recipient_native_transfer","outcome":"COMPLETED","receipt_event":"Withdrawn","recipient":"0x70997970C51812dc3A010C7d01b50e0d17dc79C8","witness":"post-transfer event in the actual EVM transaction receipt"}],"candidate":[{"amount":"20","case_id":"WITHDRAW-ALICE-20","operation":"withdraw_recipient_native_transfer","outcome":"COMPLETED","receipt_event":"Withdrawn","recipient":"0x70997970C51812dc3A010C7d01b50e0d17dc79C8","witness":"post-transfer event in the actual EVM transaction receipt"}],"changed":true}],"final_state":{"baseline":{"balances":{"alice":"70","bob":"40","owner":"0","recipient":"0"},"contract_balance":"110","paused":null,"total_deposits":"110"},"candidate":{"balances":{"alice":"80","bob":"40","owner":"0","recipient":"0"},"contract_balance":"120","paused":false,"total_deposits":"120"}},"generated_at":"2026-09-24T00:00:00.000Z","invariants":[{"id":"INV-BALANCE-CONSERVATION","observed":{"assets":"120","liabilities":"120"},"status":"PASS"},{"id":"INV-NO-UNDECLARED-ADMIN","observed":{"privileged_withdraw_succeeded":false},"status":"PASS"},{"id":"INV-WITHDRAWAL-BOUND","observed":{"failing_case_ids":[]},"status":"PASS"}],"permission_diffs":[{"baseline_allowed":false,"candidate_allowed":true,"capability":"OWNER_PAUSE_CONTROL","changed":true,"id":"DECL-PERMISSIONS"}],"run_id":"7b41227cfd08bd8dc23a0bcf","scenario_id":"honest-advance","schema_version":"1","source_date_epoch":1790208000,"state_diffs":[{"baseline":"110","candidate":"120","changed":true,"id":"STATE-CONTRACT-BALANCE"},{"baseline":"110","candidate":"120","changed":true,"id":"STATE-TOTAL-DEPOSITS"},{"baseline":"70","candidate":"80","changed":true,"id":"STATE-BALANCE-ALICE"},{"baseline":"ABSENT","candidate":"false","changed":true,"id":"STATE-PAUSED"}],"storage_diffs":[{"baseline":null,"candidate":{"encoding":"inplace","label":"paused","number_of_bytes":"1","offset":0,"slot":"2","type":"bool"},"declaration_id":"DECL-STORAGE","field":"paused","id":"STORAGE-LAYOUT-PAUSED"}],"transactions":[{"baseline":{"args":[],"calldata":"0xd0e30db0","case_id":"DEPOSIT-ALICE-100","method":"deposit","output":{"events":["Deposited"],"revert_reason":"","state_after":{"balances":{"alice":"100","bob":"0","owner":"0","recipient":"0"},"contract_balance":"100","paused":null,"total_deposits":"100"},"state_before":{"balances":{"alice":"0","bob":"0","owner":"0","recipient":"0"},"contract_balance":"0","paused":null,"total_deposits":"0"},"success":true},"receipt":{"block_hash":"0xc932fc27679c2a2cc5bf964cdcc7bcc99aea0392fb207fbe49950ec88e907efd","block_number":2,"block_timestamp":1790121602,"gas_price":"1766613929","gas_used":"67182","logs":[{"address":"0x5FbDB2315678afecb367f032d93F642f64180aa3","args":{"account":"0x70997970C51812dc3A010C7d01b50e0d17dc79C8","amount":"100"},"data":"0x0000000000000000000000000000000000000000000000000000000000000064","event_name":"Deposited","topics":["0x2da466a7b24304f47e87fa2e1e5a81b9831ce54fec19055ce277ca2f39ba42c4","0x00000000000000000000000070997970c51812dc3a010c7d01b50e0d17dc79c8"]}],"status":"SUCCESS","transaction_hash":"0x979e2b7ab500a83c7125337b4dd76b01f2faf624ec7a00e50a4fd8580ed10b2b","transaction_index":0},"sender":"alice","value":"100"},"candidate":{"args":[],"calldata":"0xd0e30db0","case_id":"DEPOSIT-ALICE-100","method":"deposit","output":{"events":["Deposited"],"revert_reason":"","state_after":{"balances":{"alice":"100","bob":"0","owner":"0","recipient":"0"},"contract_balance":"100","paused":false,"total_deposits":"100"},"state_before":{"balances":{"alice":"0","bob":"0","owner":"0","recipient":"0"},"contract_balance":"0","paused":false,"total_deposits":"0"},"success":true},"receipt":{"block_hash":"0xa9f36bbcb07fa6587975866c1ef92dc38fd1bce2f2fa34633c248a4a28ac784c","block_number":2,"block_timestamp":1790121602,"gas_price":"1766924868","gas_used":"67182","logs":[{"address":"0x5FbDB2315678afecb367f032d93F642f64180aa3","args":{"account":"0x70997970C51812dc3A010C7d01b50e0d17dc79C8","amount":"100"},"data":"0x0000000000000000000000000000000000000000000000000000000000000064","event_name":"Deposited","topics":["0x2da466a7b24304f47e87fa2e1e5a81b9831ce54fec19055ce277ca2f39ba42c4","0x00000000000000000000000070997970c51812dc3a010c7d01b50e0d17dc79c8"]}],"status":"SUCCESS","transaction_hash":"0xfb175ceabe25f45d57f36d00ab846cc5d04b7880cccb9519d9ed8179a78205dc","transaction_index":0},"sender":"alice","value":"100"},"case_id":"DEPOSIT-ALICE-100"},{"baseline":{"args":[],"calldata":"0xd0e30db0","case_id":"DEPOSIT-BOB-40","method":"deposit","output":{"events":["Deposited"],"revert_reason":"","state_after":{"balances":{"alice":"100","bob":"40","owner":"0","recipient":"0"},"contract_balance":"140","paused":null,"total_deposits":"140"},"state_before":{"balances":{"alice":"100","bob":"0","owner":"0","recipient":"0"},"contract_balance":"100","paused":null,"total_deposits":"100"},"success":true},"receipt":{"block_hash":"0xa1bd4c3b5ab809342f412b022b2060df7aa7af00ebac297193b03d63ee31e695","block_number":3,"block_timestamp":1790121603,"gas_price":"1671001783","gas_used":"50082","logs":[{"address":"0x5FbDB2315678afecb367f032d93F642f64180aa3","args":{"account":"0x3C44CdDdB6a900fa2b585dd299e03d12FA4293BC","amount":"40"},"data":"0x0000000000000000000000000000000000000000000000000000000000000028","event_name":"Deposited","topics":["0x2da466a7b24304f47e87fa2e1e5a81b9831ce54fec19055ce277ca2f39ba42c4","0x0000000000000000000000003c44cdddb6a900fa2b585dd299e03d12fa4293bc"]}],"status":"SUCCESS","transaction_hash":"0xceaf6988b0b2989ea43b4e32295cae3d16a6043c70e7f48c9eae4687015aa918","transaction_index":0},"sender":"bob","value":"40"},"candidate":{"args":[],"calldata":"0xd0e30db0","case_id":"DEPOSIT-BOB-40","method":"deposit","output":{"events":["Deposited"],"revert_reason":"","state_after":{"balances":{"alice":"100","bob":"40","owner":"0","recipient":"0"},"contract_balance":"140","paused":false,"total_deposits":"140"},"state_before":{"balances":{"alice":"100","bob":"0","owner":"0","recipient":"0"},"contract_balance":"100","paused":false,"total_deposits":"100"},"success":true},"receipt":{"block_hash":"0xd5365cddf7c6f516005e0bf9e6b36c08893bcc9a04b68c42a39ccaa09029a005","block_number":3,"block_timestamp":1790121603,"gas_price":"1671273941","gas_used":"50082","logs":[{"address":"0x5FbDB2315678afecb367f032d93F642f64180aa3","args":{"account":"0x3C44CdDdB6a900fa2b585dd299e03d12FA4293BC","amount":"40"},"data":"0x0000000000000000000000000000000000000000000000000000000000000028","event_name":"Deposited","topics":["0x2da466a7b24304f47e87fa2e1e5a81b9831ce54fec19055ce277ca2f39ba42c4","0x0000000000000000000000003c44cdddb6a900fa2b585dd299e03d12fa4293bc"]}],"status":"SUCCESS","transaction_hash":"0xeb805ad9dea1f8fff25d1bb89a24c833bd86936e330953b0237634d97ea958bf","transaction_index":0},"sender":"bob","value":"40"},"case_id":"DEPOSIT-BOB-40"},{"baseline":{"args":["20"],"calldata":"0x2e1a7d4d0000000000000000000000000000000000000000000000000000000000000014","case_id":"WITHDRAW-ALICE-20","method":"withdraw","output":{"events":["Withdrawn"],"revert_reason":"","state_after":{"balances":{"alice":"80","bob":"40","owner":"0","recipient":"0"},"contract_balance":"120","paused":null,"total_deposits":"120"},"state_before":{"balances":{"alice":"100","bob":"40","owner":"0","recipient":"0"},"contract_balance":"140","paus